{
  "packVersion": 1,
  "id": "kenney-furniture",
  "title": "Furniture Kit (2.0)",
  "licence": { "spdx": "CC0-1.0", "author": "Kenney (www.kenney.nl)", "url": "https://kenney.nl/assets/furniture-kit" },
  "source": {
    "kind": "zip",
    "page": "https://kenney.nl/assets/furniture-kit",
    "download": "https://kenney.nl/media/pages/assets/furniture-kit/440e0608a4-1677580847/kenney_furniture-kit.zip",
    "sha256": "e67652d0932cee41683f74711c03d3e192a2af9979ef8e6b237711f5482d46b0"
  },
  "owner": "third-party",
  "visibility": "public",
  "dimension": "3d",
  "signature": { "measured": "2026-10-13", "tool": "art ingest 1", "palette": { "size": 24, "saturation": 0.45 }, "trianglesPerMetre": 180, "textured": false, "outline": false },
  "fits": [ { "kind": "silly", "fits": "yes", "judged": "2026-10-13", "by": "look judge 1" }, { "kind": "scenic", "fits": "with-bridge", "judged": "2026-10-13", "note": "reads right once the scenic house material is applied" } ],
  "validators": ["gltf-validator", "budget"]
}
