{
  "packVersion": 1,
  "id": "beans",
  "title": "Jelly bean bodies",
  "describe": "Procedural jelly bean players on gf-humanoid-1: one tinted body, mitten hands, shoes, big eyes.",
  "licence": { "spdx": "CC0-1.0", "author": "xgames-kit" },
  "source": { "kind": "own", "store": "kit default set" },
  "owner": "own",
  "visibility": "public",
  "dimension": "3d",
  "validators": ["rig-check", "body-judge"]
}
